{
  "package_name": "axios",
  "old_version": "1.4.0",
  "new_version": "1.7.2",
  "ecosystem": "npm",
  "cves_closed": [
    {
      "cve_id": "CVE-2023-45857",
      "ghsa_id": "GHSA-wf5p-g6vw-rhxx",
      "summary": "Axios Cross-Site Request Forgery vulnerability due to XSRF-TOKEN cookie exposure in cross-site requests.",
      "severity": "high",
      "cvss_score": 7.1,
      "affected_range": ">=1.3.2, <1.6.1",
      "fixed_in": "1.6.1",
      "advisory_url": "https://github.com/advisories/GHSA-wf5p-g6vw-rhxx"
    }
  ],
  "cves_introduced": [],
  "cves_unresolved": [],
  "summary": "Bumping axios from 1.4.0 to 1.7.2 closes 1 high-severity CVE (CVE-2023-45857, CSRF via XSRF-TOKEN cookie exposure, fixed in 1.6.1). No new CVEs are introduced by this bump, and no CVEs remain unresolved across both versions.",
  "query_timestamp": "2026-09-27T10:30:00Z"
}
